{
  "$schema": "https://opencode.ai/desktop-theme.json",
  "name": "NOPAL-12",
  "id": "nopal-12",
  "light": {
    "palette": {
      "neutral": "#f3f3f6",
      "ink": "#1b1b1b",
      "primary": "#866161",
      "accent": "#846261",
      "success": "#746d46",
      "warning": "#746d3d",
      "error": "#866161",
      "info": "#915b5c"
    }
  },
  "dark": {
    "palette": {
      "neutral": "#92929c",
      "ink": "#000000",
      "primary": "#cca3a3",
      "accent": "#fbd4d2",
      "success": "#aba47b",
      "warning": "#f1eab6",
      "error": "#cca3a3",
      "info": "#f1b4b4"
    }
  }
}
