{
  "$schema": "https://opencode.ai/desktop-theme.json",
  "name": "Cyclope6",
  "id": "cyclope6",
  "light": {
    "palette": {
      "neutral": "#fceff5",
      "ink": "#02201d",
      "primary": "#147e66",
      "accent": "#06777b",
      "success": "#32535f",
      "warning": "#06777b",
      "error": "#147e66",
      "info": "#1c7c6e"
    }
  },
  "dark": {
    "palette": {
      "neutral": "#411d31",
      "ink": "#a0fff5",
      "primary": "#30e1b9",
      "accent": "#0b8a8f",
      "success": "#32535f",
      "warning": "#0b8a8f",
      "error": "#30e1b9",
      "info": "#0eaf9b"
    }
  }
}
