{
  "$schema": "https://opencode.ai/desktop-theme.json",
  "name": "Catppuccin Frappé — Maroon",
  "id": "catppuccin-frapp-maroon",
  "light": {
    "palette": {
      "neutral": "#f2f3f8",
      "ink": "#171a27",
      "primary": "#9c5357",
      "accent": "#9e552d",
      "success": "#a8494e",
      "warning": "#9e552d",
      "error": "#a8494e",
      "info": "#a8494e"
    }
  },
  "dark": {
    "palette": {
      "neutral": "#292c3c",
      "ink": "#c6d0f5",
      "primary": "#ea999c",
      "accent": "#ef9f76",
      "success": "#e78284",
      "warning": "#ef9f76",
      "error": "#e78284",
      "info": "#e78284"
    }
  }
}
