{
  "$schema": "https://opencode.ai/desktop-theme.json",
  "name": "Hatsune Miku",
  "id": "hatsune-miku",
  "light": {
    "palette": {
      "neutral": "#f3f3f3",
      "ink": "#1b1b1b",
      "primary": "#1b7b75",
      "accent": "#437673",
      "success": "#127c74",
      "warning": "#916106",
      "error": "#c60f42",
      "info": "#157c76"
    }
  },
  "dark": {
    "palette": {
      "neutral": "#1a1a1a",
      "ink": "#e6e6e6",
      "primary": "#39c5bb",
      "accent": "#bcf2ee",
      "success": "#2a9b92",
      "warning": "#f6c177",
      "error": "#ff0055",
      "info": "#7be1d9"
    }
  }
}
