{
  "$schema": "https://opencode.ai/desktop-theme.json",
  "name": "Ink Crimson",
  "id": "ink-crimson",
  "light": {
    "palette": {
      "neutral": "#f6f1f8",
      "ink": "#23161c",
      "primary": "#c71237",
      "accent": "#660f31",
      "success": "#197a80",
      "warning": "#1e579c",
      "error": "#c71237",
      "info": "#9c173b"
    }
  },
  "dark": {
    "palette": {
      "neutral": "#09010d",
      "ink": "#ffd9e8",
      "primary": "#ff0546",
      "accent": "#660f31",
      "success": "#0ce6f2",
      "warning": "#1e579c",
      "error": "#ff0546",
      "info": "#9c173b"
    }
  }
}
