{
  "$schema": "https://opencode.ai/desktop-theme.json",
  "name": "Catppuccin Macchiato — Lavender",
  "id": "catppuccin-macchiato-lavender",
  "light": {
    "palette": {
      "neutral": "#f2f3f9",
      "ink": "#171a26",
      "primary": "#62669b",
      "accent": "#307782",
      "success": "#7c57a6",
      "warning": "#9c572e",
      "error": "#a74859",
      "info": "#4a6aab"
    }
  },
  "dark": {
    "palette": {
      "neutral": "#1e2030",
      "ink": "#cad3f5",
      "primary": "#b7bdf8",
      "accent": "#91d7e3",
      "success": "#c6a0f6",
      "warning": "#f5a97f",
      "error": "#ed8796",
      "info": "#8aadf4"
    }
  }
}
