{
  "$schema": "https://opencode.ai/desktop-theme.json",
  "name": "soapy 10",
  "id": "soapy-10",
  "light": {
    "palette": {
      "neutral": "#eef4fe",
      "ink": "#2a1217",
      "primary": "#167e62",
      "accent": "#995363",
      "success": "#0c6987",
      "warning": "#ae3875",
      "error": "#af1ba2",
      "info": "#1d7a7c"
    }
  },
  "dark": {
    "palette": {
      "neutral": "#0d2147",
      "ink": "#ffb0bf",
      "primary": "#54cea7",
      "accent": "#ffb0bf",
      "success": "#0c6987",
      "warning": "#ff82bd",
      "error": "#d74ac7",
      "info": "#2ba4a6"
    }
  }
}
