{
  "$schema": "https://opencode.ai/desktop-theme.json",
  "name": "Catppuccin Mocha — Rosewater",
  "id": "catppuccin-mocha-rosewater",
  "light": {
    "palette": {
      "neutral": "#f3f3f8",
      "ink": "#171a25",
      "primary": "#796764",
      "accent": "#885b7c",
      "success": "#99592f",
      "warning": "#99592f",
      "error": "#a64665",
      "info": "#826263"
    }
  },
  "dark": {
    "palette": {
      "neutral": "#181825",
      "ink": "#cdd6f4",
      "primary": "#f5e0dc",
      "accent": "#f5c2e7",
      "success": "#fab387",
      "warning": "#fab387",
      "error": "#f38ba8",
      "info": "#f2cdcd"
    }
  }
}
