{
  "$schema": "https://opencode.ai/desktop-theme.json",
  "name": "Fire Spring",
  "id": "fire-spring",
  "light": {
    "palette": {
      "neutral": "#f5f2f8",
      "ink": "#1c1c08",
      "primary": "#8c48af",
      "accent": "#735f9a",
      "success": "#8938cb",
      "warning": "#746f1a",
      "error": "#be2d36",
      "info": "#6f609f"
    }
  },
  "dark": {
    "palette": {
      "neutral": "#181020",
      "ink": "#ffffca",
      "primary": "#d992ff",
      "accent": "#c4b0f0",
      "success": "#9b4de0",
      "warning": "#f0e500",
      "error": "#ff6b6b",
      "info": "#a99ade"
    }
  }
}
