{
  "$schema": "https://opencode.ai/desktop-theme.json",
  "name": "YouTube Dark",
  "id": "you-tube-dark",
  "light": {
    "palette": {
      "neutral": "#f3f3f3",
      "ink": "#1b1b1b",
      "primary": "#c8140d",
      "accent": "#995654",
      "success": "#c4241a",
      "warning": "#916106",
      "error": "#c8140d",
      "info": "#cb0413"
    }
  },
  "dark": {
    "palette": {
      "neutral": "#0f0f0f",
      "ink": "#f1f1f1",
      "primary": "#ff0000",
      "accent": "#ffb3b0",
      "success": "#cc0000",
      "warning": "#f6c177",
      "error": "#ff0000",
      "info": "#ff4e45"
    }
  }
}
