{
  "$schema": "https://opencode.ai/desktop-theme.json",
  "name": "Catppuccin Macchiato — Peach",
  "id": "catppuccin-macchiato-peach",
  "light": {
    "palette": {
      "neutral": "#f2f3f9",
      "ink": "#171a26",
      "primary": "#9c572e",
      "accent": "#7c6662",
      "success": "#9e5159",
      "warning": "#9c572e",
      "error": "#a74859",
      "info": "#806836"
    }
  },
  "dark": {
    "palette": {
      "neutral": "#1e2030",
      "ink": "#cad3f5",
      "primary": "#f5a97f",
      "accent": "#f4dbd6",
      "success": "#ee99a0",
      "warning": "#f5a97f",
      "error": "#ed8796",
      "info": "#eed49f"
    }
  }
}
