{
  "$schema": "https://opencode.ai/desktop-theme.json",
  "name": "Rose Pine Moon — Foam",
  "id": "rose-pine-moon-foam",
  "light": {
    "palette": {
      "neutral": "#f3f3fa",
      "ink": "#1a1921",
      "primary": "#44757d",
      "accent": "#6b697c",
      "success": "#1d7494",
      "warning": "#916106",
      "error": "#b13a61",
      "info": "#795d98"
    }
  },
  "dark": {
    "palette": {
      "neutral": "#232136",
      "ink": "#e0def4",
      "primary": "#9ccfd8",
      "accent": "#e0def4",
      "success": "#3e8fb0",
      "warning": "#f6c177",
      "error": "#eb6f92",
      "info": "#c4a7e7"
    }
  }
}
