{
  "$schema": "https://opencode.ai/desktop-theme.json",
  "name": "Pink Glaze Macaroon",
  "id": "pink-glaze-macaroon",
  "light": {
    "palette": {
      "neutral": "#f5f3f3",
      "ink": "#1c1b16",
      "primary": "#c21c50",
      "accent": "#7f6466",
      "success": "#a7446e",
      "warning": "#816172",
      "error": "#a34c6d",
      "info": "#816172"
    }
  },
  "dark": {
    "palette": {
      "neutral": "#1a1416",
      "ink": "#ede9dc",
      "primary": "#f45378",
      "accent": "#fadadd",
      "success": "#d9719a",
      "warning": "#f7d2e5",
      "error": "#b75e7e",
      "info": "#f7d2e5"
    }
  }
}
