{
  "$schema": "https://opencode.ai/desktop-theme.json",
  "name": "Catppuccin Mocha — Green",
  "id": "catppuccin-mocha-green",
  "light": {
    "palette": {
      "neutral": "#f3f3f8",
      "ink": "#171a25",
      "primary": "#427c3f",
      "accent": "#427c3f",
      "success": "#197698",
      "warning": "#99592f",
      "error": "#a64665",
      "info": "#2a7b70"
    }
  },
  "dark": {
    "palette": {
      "neutral": "#181825",
      "ink": "#cdd6f4",
      "primary": "#a6e3a1",
      "accent": "#a6e3a1",
      "success": "#74c7ec",
      "warning": "#fab387",
      "error": "#f38ba8",
      "info": "#94e2d5"
    }
  }
}
