{
  "$schema": "https://opencode.ai/desktop-theme.json",
  "name": "Catppuccin Sibling — Petal",
  "id": "catppuccin-sibling-petal",
  "light": {
    "palette": {
      "neutral": "#f6f2f3",
      "ink": "#1f1919",
      "primary": "#785e95",
      "accent": "#816078",
      "success": "#437099",
      "warning": "#7e674a",
      "error": "#9b525d",
      "info": "#696692"
    }
  },
  "dark": {
    "palette": {
      "neutral": "#211618",
      "ink": "#e4d2d4",
      "primary": "#c7abe7",
      "accent": "#edc7e2",
      "success": "#89b8e5",
      "warning": "#fae0bf",
      "error": "#e696a0",
      "info": "#bfbdee"
    }
  }
}
