{
  "$schema": "https://opencode.ai/desktop-theme.json",
  "name": "Catppuccin Macchiato — Green",
  "id": "catppuccin-macchiato-green",
  "light": {
    "palette": {
      "neutral": "#f2f3f9",
      "ink": "#171a26",
      "primary": "#4b7a3a",
      "accent": "#4b7a3a",
      "success": "#2c7592",
      "warning": "#9c572e",
      "error": "#a74859",
      "info": "#2e7a71"
    }
  },
  "dark": {
    "palette": {
      "neutral": "#1e2030",
      "ink": "#cad3f5",
      "primary": "#a6da95",
      "accent": "#a6da95",
      "success": "#7dc4e4",
      "warning": "#f5a97f",
      "error": "#ed8796",
      "info": "#8bd5ca"
    }
  }
}
