{
  "$schema": "https://opencode.ai/desktop-theme.json",
  "name": "Ethereal Fallen Angel",
  "id": "ethereal-fallen-angel",
  "light": {
    "palette": {
      "neutral": "#f3f3f3",
      "ink": "#1b1b1b",
      "primary": "#6c6c6c",
      "accent": "#7f6464",
      "success": "#6c6c6c",
      "warning": "#85671a",
      "error": "#be2d36",
      "info": "#995657"
    }
  },
  "dark": {
    "palette": {
      "neutral": "#080808",
      "ink": "#f0f0f0",
      "primary": "#ffffff",
      "accent": "#ffe0e0",
      "success": "#cccccc",
      "warning": "#ffd166",
      "error": "#ff6b6b",
      "info": "#ffb3b3"
    }
  }
}
