{
  "$schema": "https://opencode.ai/desktop-theme.json",
  "name": "Catppuccin Mocha — Yellow",
  "id": "catppuccin-mocha-yellow",
  "light": {
    "palette": {
      "neutral": "#f3f3f8",
      "ink": "#171a25",
      "primary": "#7e693a",
      "accent": "#796764",
      "success": "#985461",
      "warning": "#99592f",
      "error": "#a64665",
      "info": "#99592f"
    }
  },
  "dark": {
    "palette": {
      "neutral": "#181825",
      "ink": "#cdd6f4",
      "primary": "#f9e2af",
      "accent": "#f5e0dc",
      "success": "#eba0ac",
      "warning": "#fab387",
      "error": "#f38ba8",
      "info": "#fab387"
    }
  }
}
