{
  "$schema": "https://opencode.ai/desktop-theme.json",
  "name": "Fluffy Dark",
  "id": "fluffy-dark",
  "light": {
    "palette": {
      "neutral": "#f3f3f3",
      "ink": "#1b1b1b",
      "primary": "#a4486a",
      "accent": "#7a656c",
      "success": "#c2185b",
      "warning": "#6f6f41",
      "error": "#945b44",
      "info": "#8f596d"
    }
  },
  "dark": {
    "palette": {
      "neutral": "#212121",
      "ink": "#d4d4d4",
      "primary": "#f48fb1",
      "accent": "#fce4ec",
      "success": "#c2185b",
      "warning": "#dcdcaa",
      "error": "#ce9178",
      "info": "#f8bbd0"
    }
  }
}
