{
  "$schema": "https://opencode.ai/desktop-theme.json",
  "name": "Catppuccin Mocha — Pink",
  "id": "catppuccin-mocha-pink",
  "light": {
    "palette": {
      "neutral": "#f3f3f8",
      "ink": "#171a25",
      "primary": "#885b7c",
      "accent": "#826263",
      "success": "#7c58a3",
      "warning": "#99592f",
      "error": "#a64665",
      "info": "#796764"
    }
  },
  "dark": {
    "palette": {
      "neutral": "#181825",
      "ink": "#cdd6f4",
      "primary": "#f5c2e7",
      "accent": "#f2cdcd",
      "success": "#cba6f7",
      "warning": "#fab387",
      "error": "#f38ba8",
      "info": "#f5e0dc"
    }
  }
}
